{
  "$schema": "https://json-schema.org/draft/2020-12/schema",
  "$id": "https://github.com/CL-BAF/Kobald-EvalKit/case-schema.json",
  "title": "EvalKit Case File (schema v1)",
  "type": "object",
  "additionalProperties": false,
  "required": ["case_id", "suite", "title", "purpose", "evidence", "instruction", "constraints", "scoring", "expected"],
  "properties": {
    "schema_version": {
      "type": "string",
      "enum": ["1"],
      "default": "1",
      "description": "Optional; default '1' when absent. Unknown versions rejected in v0.1 (Amendment v0.1.2 #1)."
    },
    "case_id": {
      "type": "string",
      "pattern": "^[a-z][a-z0-9_]{0,63}$",
      "description": "Must equal the filename stem (loader-enforced)."
    },
    "suite": {
      "type": "string",
      "pattern": "^[a-z][a-z0-9_]*$",
      "description": "Must match the parent directory name; directory must be in the v0.1 suite registry."
    },
    "title": {
      "type": "string",
      "minLength": 1,
      "maxLength": 200
    },
    "purpose": {
      "type": "string",
      "minLength": 1,
      "maxLength": 2000,
      "description": "Mandatory and meaningful: what behaviour is tested and why it matters."
    },
    "evidence": {
      "type": "array",
      "maxItems": 12,
      "items": {
        "type": "object",
        "additionalProperties": false,
        "required": ["id", "text"],
        "properties": {
          "id": {
            "type": "string",
            "pattern": "^[A-Z0-9][A-Z0-9-]{1,23}$",
            "description": "Uppercase evidence ID; matches the citation-token regex so format mismatches are detectable. Unique within the case."
          },
          "text": {
            "type": "string",
            "minLength": 1,
            "maxLength": 4000
          }
        }
      }
    },
    "instruction": {
      "type": "string",
      "minLength": 1,
      "maxLength": 6000,
      "description": "Sent to the model VERBATIM as the user turn; must be self-contained (references evidence by ID, includes format rules)."
    },
    "constraints": {
      "type": "string",
      "minLength": 1,
      "maxLength": 2000,
      "description": "Human-readable summary of a compliant response; never machine-enforced."
    },
    "scoring": {
      "type": "array",
      "minItems": 1,
      "maxItems": 8,
      "items": {
        "type": "object",
        "additionalProperties": false,
        "required": ["type", "params"],
        "properties": {
          "type": {
            "type": "string",
            "description": "Registered scorer name; unknown types rejected by the loader. See docs/scoring.md."
          },
          "params": {
            "type": "object",
            "description": "The ONLY enforcement source. Scorers never read 'expected' or 'constraints'."
          },
          "weight": {
            "type": "number",
            "minimum": 0.5,
            "maximum": 5,
            "default": 1.0,
            "description": "Float, optional, default 1.0 (Amendment v0.1.3 #6). Reported aggregates only; never pass/fail."
          }
        }
      }
    },
    "expected": {
      "type": "string",
      "minLength": 1,
      "maxLength": 2000,
      "description": "DOCUMENTATION-ONLY sketch of a good response for human review (Amendment v0.1.2 #5)."
    }
  }
}