{
  "schema_version": "1",
  "case_id": "grounding_lima",
  "suite": "evidence_grounding",
  "title": "Capital of Peru",
  "purpose": "Valid full case: two evidence lines, three checks including a weight-boundary 5 to exercise aggregate weighting.",
  "evidence": [
    {"id": "GEO-1", "text": "Lima is the capital of Peru."},
    {"id": "GEO-2", "text": "Peru is in South America."}
  ],
  "instruction": "Using only the evidence provided, name the capital of Peru. Cite the evidence line you used with a bracketed token like [GEO-1].",
  "constraints": "Answer with the city name and citation only; do not invent sources.",
  "scoring": [
    {"type": "required_source_ids", "params": {"ids": ["GEO-1"], "allow_extras": false}, "weight": 2},
    {"type": "invented_citations", "params": {"max_allowed": 0, "ids": ["GEO-1", "GEO-2"]}, "weight": 1},
    {"type": "required_source_ids", "params": {"ids": ["GEO-2"], "allow_extras": true}, "weight": 5}
  ],
  "expected": "Lima [GEO-1]"
}